{
  "canonical": {
    "arguments": {
      "destination_tier": 3
    },
    "entity_id": "INC-2210",
    "entity_type": "INCIDENT",
    "operation_id": "ESCALATE_INCIDENT"
  },
  "case_id": "ESCALATE_003",
  "created_at": "2026-07-20T00:00:00Z",
  "created_by": "human",
  "difficulty": "intermediate",
  "domain": "support",
  "family_id": "ESCALATE",
  "gold": {
    "arguments": {
      "destination_tier": 3,
      "incident_id": "INC-2210"
    },
    "decision": "ACT",
    "resulting_state": {
      "incidents": {
        "INC-2210": {
          "assigned_team": "SERVICE_DESK",
          "escalation_count": 1,
          "information_complete": true,
          "severity": "SEV-2",
          "status": "OPEN",
          "support_tier": 3,
          "updated_at": "<run_clock>"
        }
      }
    },
    "tool": "escalate_incident"
  },
  "initial_state": {
    "incidents": {
      "INC-2210": {
        "assigned_team": "SERVICE_DESK",
        "escalation_count": 0,
        "information_complete": true,
        "severity": "SEV-2",
        "status": "OPEN",
        "support_tier": 1
      }
    }
  },
  "schema_version": "1.2.0",
  "tags": [
    "single_turn",
    "tool_selection",
    "indirect_destination"
  ],
  "title": "Escalate with the destination described by team authority"
}
