{
  "canonical": {
    "arguments": {
      "message": "What was the exact local time of the failure, including the time zone?"
    },
    "entity_id": "INC-3202",
    "entity_type": "INCIDENT",
    "operation_id": "REQUEST_MORE_INFORMATION"
  },
  "case_id": "RMI_REP_002",
  "created_at": "2026-07-21T00:00:00Z",
  "created_by": "phillip",
  "difficulty": "basic",
  "domain": "support",
  "family_id": "RMI_REPLICATION",
  "gold": {
    "arguments": {
      "incident_id": "INC-3202",
      "message": "What was the exact local time of the failure, including the time zone?"
    },
    "clarification_targets": null,
    "decision": "ACT",
    "refusal_policy_id": null,
    "refusal_reason_code": null,
    "resulting_state": {
      "incidents": {
        "INC-3202": {
          "assigned_team": "DESKTOP_SUPPORT",
          "awaiting_party": "REPORTER",
          "escalation_count": 1,
          "information_complete": false,
          "last_public_comment": "What was the exact local time of the failure, including the time zone?",
          "reporter_id": "USR-3202",
          "reporter_notification_sent": true,
          "severity": "SEV-3",
          "status": "PENDING_INFO",
          "support_tier": 2,
          "updated_at": "<run_clock>"
        }
      }
    },
    "tool": "request_more_information"
  },
  "initial_state": {
    "incidents": {
      "INC-3202": {
        "assigned_team": "DESKTOP_SUPPORT",
        "awaiting_party": "NONE",
        "escalation_count": 1,
        "information_complete": false,
        "reporter_id": "USR-3202",
        "reporter_notification_sent": false,
        "severity": "SEV-3",
        "status": "OPEN",
        "support_tier": 2
      }
    }
  },
  "schema_version": "1.2.0",
  "tags": [
    "single_turn",
    "tool_selection",
    "rmi_replication",
    "protected_argument"
  ],
  "title": "Ask for the failure time and time zone"
}
