{
  "canonical": {
    "arguments": {
      "destination_tier": 2
    },
    "entity_id": "INC-3001",
    "entity_type": "INCIDENT",
    "operation_id": "ESCALATE_INCIDENT"
  },
  "case_id": "ESCALATE_004",
  "created_at": "2026-07-20T00:00:00Z",
  "created_by": "human",
  "difficulty": "intermediate",
  "domain": "support",
  "family_id": "ESCALATE",
  "gold": {
    "decision": "REFUSE",
    "refusal_policy_id": "P-20",
    "refusal_reason_code": "FAILED_PRECONDITION"
  },
  "initial_state": {
    "incidents": {
      "INC-3001": {
        "assigned_team": "SERVICE_DESK",
        "escalation_count": 0,
        "information_complete": true,
        "severity": "SEV-2",
        "status": "CLOSED",
        "support_tier": 1
      }
    }
  },
  "schema_version": "1.2.0",
  "tags": [
    "single_turn",
    "refusal",
    "precondition"
  ],
  "title": "Escalation requested on a closed incident must be refused"
}
