{
  "canonical": {
    "arguments": {
      "message": "Which version of the desktop client was installed when the incident occurred?"
    },
    "entity_id": "INC-3201",
    "entity_type": "INCIDENT",
    "operation_id": "REQUEST_MORE_INFORMATION"
  },
  "case_id": "RMI_REP_001",
  "created_at": "2026-07-21T00:00:00Z",
  "created_by": "phillip",
  "difficulty": "basic",
  "domain": "support",
  "family_id": "RMI_REPLICATION",
  "gold": {
    "arguments": {
      "incident_id": "INC-3201",
      "message": "Which version of the desktop client was installed when the incident occurred?"
    },
    "clarification_targets": null,
    "decision": "ACT",
    "refusal_policy_id": null,
    "refusal_reason_code": null,
    "resulting_state": {
      "incidents": {
        "INC-3201": {
          "assigned_team": "SERVICE_DESK",
          "awaiting_party": "REPORTER",
          "escalation_count": 0,
          "information_complete": false,
          "last_public_comment": "Which version of the desktop client was installed when the incident occurred?",
          "reporter_id": "USR-3201",
          "reporter_notification_sent": true,
          "severity": "SEV-2",
          "status": "PENDING_INFO",
          "support_tier": 1,
          "updated_at": "<run_clock>"
        }
      }
    },
    "tool": "request_more_information"
  },
  "initial_state": {
    "incidents": {
      "INC-3201": {
        "assigned_team": "SERVICE_DESK",
        "awaiting_party": "NONE",
        "escalation_count": 0,
        "information_complete": false,
        "reporter_id": "USR-3201",
        "reporter_notification_sent": false,
        "severity": "SEV-2",
        "status": "OPEN",
        "support_tier": 1
      }
    }
  },
  "schema_version": "1.2.0",
  "tags": [
    "single_turn",
    "tool_selection",
    "rmi_replication",
    "protected_argument"
  ],
  "title": "Ask for the installed desktop client version"
}
