{
  "canonical": {
    "arguments": {
      "message": "Were you connected through the corporate VPN, and from which office or network?"
    },
    "entity_id": "INC-3207",
    "entity_type": "INCIDENT",
    "operation_id": "REQUEST_MORE_INFORMATION"
  },
  "case_id": "RMI_REP_007",
  "created_at": "2026-07-21T00:00:00Z",
  "created_by": "phillip",
  "difficulty": "intermediate",
  "domain": "support",
  "family_id": "RMI_REPLICATION",
  "gold": {
    "arguments": {
      "incident_id": "INC-3207",
      "message": "Were you connected through the corporate VPN, and from which office or network?"
    },
    "clarification_targets": null,
    "decision": "ACT",
    "refusal_policy_id": null,
    "refusal_reason_code": null,
    "resulting_state": {
      "incidents": {
        "INC-3207": {
          "assigned_team": "NETWORK_OPERATIONS",
          "awaiting_party": "REPORTER",
          "escalation_count": 1,
          "information_complete": false,
          "last_public_comment": "Were you connected through the corporate VPN, and from which office or network?",
          "reporter_id": "USR-3207",
          "reporter_notification_sent": true,
          "severity": "SEV-2",
          "status": "PENDING_INFO",
          "support_tier": 2,
          "updated_at": "<run_clock>"
        }
      }
    },
    "tool": "request_more_information"
  },
  "initial_state": {
    "incidents": {
      "INC-3207": {
        "assigned_team": "NETWORK_OPERATIONS",
        "awaiting_party": "NONE",
        "escalation_count": 1,
        "information_complete": false,
        "reporter_id": "USR-3207",
        "reporter_notification_sent": false,
        "severity": "SEV-2",
        "status": "OPEN",
        "support_tier": 2
      }
    }
  },
  "schema_version": "1.2.0",
  "tags": [
    "single_turn",
    "tool_selection",
    "rmi_replication",
    "protected_argument"
  ],
  "title": "Ask for VPN and network-location details"
}
